{
  "id": "source:bache:LSDMU:bib:shulgin-shulgin-1991-pihkal",
  "type": "book",
  "author": [
    {
      "family": "Shulgin",
      "given": "Alexander"
    },
    {
      "family": "Shulgin",
      "given": "Ann"
    }
  ],
  "title": "PIHKAL—A chemical love story",
  "issued": {
    "date-parts": [
      [
        1991
      ]
    ]
  },
  "publisher": "Transform Press",
  "publisher-place": "Berkeley, CA",
  "language": "en",
  "x-bache": {
    "namespace": "bache",
    "citation_shorthand": "Shulgin & Shulgin 1991",
    "topics": [
      "psychedelics",
      "pharmacology"
    ],
    "review_state": "draft",
    "provenance": {
      "entered_by": "editor.hrl",
      "entered_at": "2025-10-28"
    }
  }
}
