{
  "id": "source:bache:LSDMU:bib:bache-2008-living-classroom",
  "type": "book",
  "author": [
    {
      "family": "Bache",
      "given": "Christopher",
      "x-bache": {
        "wikidata": "Q112496741"
      }
    }
  ],
  "title": "The living classroom",
  "issued": {
    "date-parts": [
      [
        2008
      ]
    ]
  },
  "publisher": "State University of New York Press",
  "publisher-place": "Albany, NY",
  "language": "en",
  "x-bache": {
    "namespace": "bache",
    "citation_shorthand": "Bache 2008",
    "topics": [
      "consciousness",
      "culture"
    ],
    "review_state": "draft",
    "wikidata": "Q136684793",
    "provenance": {
      "entered_by": "editor.hrl",
      "entered_at": "2025-10-28",
      "meta_ref": "bache-archive-meta/wikidata.jsonld",
      "meta_commit": "HEAD",
      "resolved_at": "2025-11-01T00:00:00Z"
    }
  }
}