{
  "id": "source:bache:LSDMU:bib:emmerson-2007-ego-state-therapy",
  "type": "book",
  "author": [
    {
      "family": "Emmerson",
      "given": "Gordon"
    }
  ],
  "title": "Ego state therapy",
  "issued": {
    "date-parts": [
      [
        2007
      ]
    ]
  },
  "publisher": "Crown House Publishing",
  "publisher-place": "Bethel, CT",
  "language": "en",
  "x-bache": {
    "namespace": "bache",
    "citation_shorthand": "Emmerson 2007",
    "topics": [
      "therapy",
      "psychology"
    ],
    "review_state": "draft",
    "provenance": {
      "entered_by": "editor.hrl",
      "entered_at": "2025-10-28"
    }
  }
}
