{
  "id": "source:bache:LSDMU:bib:bache-2000-dark-night-early-dawn",
  "type": "book",
  "author": [
    {
      "family": "Bache",
      "given": "Christopher",
      "x-bache": {
        "wikidata": "Q112496741"
      }
    }
  ],
  "title": "Dark night, early dawn",
  "issued": {
    "date-parts": [
      [
        2000
      ]
    ]
  },
  "publisher": "State University of New York Press",
  "publisher-place": "Albany, NY",
  "language": "en",
  "x-bache": {
    "namespace": "bache",
    "citation_shorthand": "Bache 2000",
    "topics": [
      "transpersonal-psychology",
      "consciousness",
      "mysticism"
    ],
    "review_state": "draft",
    "provenance": {
      "entered_by": "editor.hrl",
      "entered_at": "2025-10-28",
      "meta_ref": "meta/wikidata.jsonld",
      "meta_commit": "c201c53",
      "resolved_at": "2025-11-01T20:14:34Z"
    },
    "wikidata": "Q136684765"
  }
}
