{
  "id": "source:bache:LSDMU:bib:russell-2009-waking-up-in-time",
  "type": "book",
  "author": [
    {
      "family": "Russell",
      "given": "Peter"
    }
  ],
  "title": "Waking up in time",
  "issued": {
    "date-parts": [
      [
        2009
      ]
    ]
  },
  "original-date": {
    "date-parts": [
      [
        1992
      ]
    ]
  },
  "publisher": "Origins Press",
  "publisher-place": "San Rafael, CA",
  "language": "en",
  "x-bache": {
    "namespace": "bache",
    "citation_shorthand": "Russell 1992/2009",
    "topics": [
      "consciousness",
      "future-studies"
    ],
    "review_state": "draft",
    "provenance": {
      "entered_by": "editor.hrl",
      "entered_at": "2025-10-28"
    }
  }
}
