{
  "id": "source:bache:LSDMU:bib:bache-1990-lifecycles",
  "type": "book",
  "author": [
    {
      "family": "Bache",
      "given": "Christopher",
      "x-bache": {
        "wikidata": "Q112496741",
        "openalex": "A5045900737"
      }
    }
  ],
  "title": "Lifecycles: Reincarnation and the Web of Life",
  "issued": {
    "date-parts": [
      [
        1990
      ]
    ]
  },
  "publisher": "Paragon House",
  "publisher-place": "New York, NY",
  "language": "en",
  "ISBN": "9781557786456",
  "x-bache": {
    "namespace": "bache",
    "citation_shorthand": "Bache 1990",
    "topics": [
      "transpersonal-psychology",
      "consciousness"
    ],
    "review_state": "steward-reviewed",
    "wikidata": "Q136684807",
    "isbn_10": "1557786453",
    "provenance": {
      "entered_by": "editor.hrl",
      "entered_at": "2025-10-28",
      "meta_ref": "meta/wikidata.jsonld",
      "meta_commit": "6d3606c",
      "resolved_at": "2025-11-01T20:14:34Z"
    }
  }
}