{
  "id": "source:bache:LSDMU:bib:stevenson-1974b-xenoglossy",
  "type": "book",
  "author": [
    {
      "family": "Stevenson",
      "given": "Ian"
    }
  ],
  "title": "Xenoglossy",
  "issued": {
    "date-parts": [
      [
        1974
      ]
    ]
  },
  "publisher": "University Press of Virginia",
  "publisher-place": "Charlottesville, VA",
  "language": "en",
  "x-bache": {
    "namespace": "bache",
    "citation_shorthand": "Stevenson 1974b",
    "topics": [
      "reincarnation",
      "consciousness"
    ],
    "review_state": "draft",
    "provenance": {
      "entered_by": "editor.hrl",
      "entered_at": "2025-10-28"
    }
  }
}
