{
  "id": "source:bache:LSDMU:bib:zaehner-1959-mysticism-sacred-and-profane",
  "type": "book",
  "author": [
    {
      "family": "Zaehner",
      "given": "R. C."
    }
  ],
  "title": "Mysticism: Sacred and profane",
  "issued": {
    "date-parts": [
      [
        1959
      ]
    ]
  },
  "publisher": "Oxford University Press",
  "publisher-place": "London, UK",
  "language": "en",
  "x-bache": {
    "namespace": "bache",
    "citation_shorthand": "Zaehner 1959",
    "topics": [
      "mysticism",
      "religion"
    ],
    "review_state": "draft",
    "provenance": {
      "entered_by": "editor.hrl",
      "entered_at": "2025-10-28"
    }
  }
}
