{
  "id": "source:bache:LSDMU:bib:laszlo-2017-intelligence-of-the-cosmos",
  "type": "book",
  "author": [
    {
      "family": "Laszlo",
      "given": "Ervin"
    }
  ],
  "title": "The intelligence of the cosmos",
  "issued": {
    "date-parts": [
      [
        2017
      ]
    ]
  },
  "publisher": "Inner Traditions",
  "publisher-place": "Rochester, VT",
  "language": "en",
  "x-bache": {
    "namespace": "bache",
    "citation_shorthand": "Laszlo 2017",
    "topics": [
      "field-consciousness",
      "cosmology",
      "ecospirituality"
    ],
    "review_state": "draft",
    "provenance": {
      "entered_by": "editor.hrl",
      "entered_at": "2025-10-28"
    }
  }
}
