{
  "id": "source:bache:LSDMU:bib:strassman-2001-dmt-the-spirit-molecule",
  "type": "book",
  "author": [
    {
      "family": "Strassman",
      "given": "Rick"
    }
  ],
  "title": "DMT: The spirit molecule",
  "issued": {
    "date-parts": [
      [
        2001
      ]
    ]
  },
  "publisher": "Park Street Press",
  "publisher-place": "Rochester, VT",
  "language": "en",
  "x-bache": {
    "namespace": "bache",
    "citation_shorthand": "Strassman 2001",
    "topics": [
      "dmt",
      "psychedelics",
      "science"
    ],
    "review_state": "draft",
    "provenance": {
      "entered_by": "editor.hrl",
      "entered_at": "2025-10-28"
    }
  }
}
