{
  "id": "source:bache:LSDMU:bib:meadows-1972-limits-to-growth",
  "type": "book",
  "author": [
    {
      "family": "Meadows",
      "given": "Donella"
    },
    {
      "family": "Meadows",
      "given": "Dennis"
    },
    {
      "family": "Randers",
      "given": "Jorgen"
    }
  ],
  "title": "The limits to growth",
  "issued": {
    "date-parts": [
      [
        1972
      ]
    ]
  },
  "publisher": "Universe Books",
  "publisher-place": "New York, NY",
  "language": "en",
  "x-bache": {
    "namespace": "bache",
    "citation_shorthand": "Meadows et al. 1972",
    "topics": [
      "ecology",
      "systems-theory",
      "future-studies"
    ],
    "review_state": "draft",
    "provenance": {
      "entered_by": "editor.hrl",
      "entered_at": "2025-10-28"
    }
  }
}
