{
  "id": "source:bache:LSDMU:bib:ferrer-2011b-participatory-spirituality-ten-year-retrospective",
  "type": "article-journal",
  "author": [
    {
      "family": "Ferrer",
      "given": "Jorge"
    }
  ],
  "title": "Participatory spirituality and transpersonal theory: A ten-year retrospective",
  "container-title": "Journal of Transpersonal Psychology",
  "issued": {
    "date-parts": [
      [
        2011
      ]
    ]
  },
  "volume": "43",
  "issue": "1",
  "page": "1-34",
  "language": "en",
  "x-bache": {
    "namespace": "bache",
    "citation_shorthand": "Ferrer 2011b",
    "topics": [
      "transpersonal-psychology",
      "participatory-spirituality"
    ],
    "review_state": "draft",
    "provenance": {
      "entered_by": "editor.hrl",
      "entered_at": "2025-10-28"
    }
  }
}
