{
  "id": "source:bache:LSDMU:bib:grof-1976-realms-of-the-human-unconscious",
  "type": "book",
  "author": [
    {
      "family": "Grof",
      "given": "Stanislav"
    }
  ],
  "title": "Realms of the human unconscious",
  "issued": {
    "date-parts": [
      [
        1976
      ]
    ]
  },
  "publisher": "Dutton",
  "publisher-place": "New York, NY",
  "language": "en",
  "x-bache": {
    "namespace": "bache",
    "citation_shorthand": "Grof 1976",
    "topics": [
      "psychedelics",
      "consciousness",
      "transpersonal-psychology"
    ],
    "review_state": "draft",
    "provenance": {
      "entered_by": "editor.hrl",
      "entered_at": "2025-10-28"
    }
  }
}
