{
  "id": "source:bache:LSDMU:bib:sheldrake-1981-new-science-of-life",
  "type": "book",
  "author": [
    {
      "family": "Sheldrake",
      "given": "Rupert"
    }
  ],
  "title": "A new science of life",
  "issued": {
    "date-parts": [
      [
        1981
      ]
    ]
  },
  "publisher": "J. P. Tarcher",
  "publisher-place": "Los Angeles, CA",
  "language": "en",
  "x-bache": {
    "namespace": "bache",
    "citation_shorthand": "Sheldrake 1981",
    "topics": [
      "biology",
      "systems-theory"
    ],
    "review_state": "draft",
    "provenance": {
      "entered_by": "editor.hrl",
      "entered_at": "2025-10-28"
    }
  }
}
