{
  "id": "source:bache:LSDMU:bib:meadows-2004-limits-to-growth",
  "type": "book",
  "author": [
    {
      "family": "Meadows",
      "given": "Donella"
    },
    {
      "family": "Meadows",
      "given": "Dennis"
    },
    {
      "family": "Randers",
      "given": "Jorgen"
    }
  ],
  "title": "Limits to growth",
  "issued": {
    "date-parts": [
      [
        2004
      ]
    ]
  },
  "publisher": "Chelsea Green Publishing",
  "publisher-place": "White River Junction, VT",
  "language": "en",
  "x-bache": {
    "namespace": "bache",
    "citation_shorthand": "Meadows et al. 2004",
    "topics": [
      "ecology",
      "systems-theory"
    ],
    "review_state": "draft",
    "provenance": {
      "entered_by": "editor.hrl",
      "entered_at": "2025-10-28"
    }
  }
}
