{
  "id": "source:bache:LSDMU:bib:wilber-1995-sex-ecology-spirituality",
  "type": "book",
  "author": [
    {
      "family": "Wilber",
      "given": "Ken"
    }
  ],
  "title": "Sex, ecology, spirituality",
  "issued": {
    "date-parts": [
      [
        1995
      ]
    ]
  },
  "publisher": "Shambhala Publications",
  "publisher-place": "Boston, MA",
  "language": "en",
  "x-bache": {
    "namespace": "bache",
    "citation_shorthand": "Wilber 1995",
    "topics": [
      "consciousness",
      "integral-yoga",
      "systems-theory"
    ],
    "review_state": "draft",
    "provenance": {
      "entered_by": "editor.hrl",
      "entered_at": "2025-10-28"
    }
  }
}
