{
  "id": "source:bache:LSDMU:bib:ring-1984-heading-toward-omega",
  "type": "book",
  "author": [
    {
      "family": "Ring",
      "given": "Kenneth"
    }
  ],
  "title": "Heading toward omega",
  "issued": {
    "date-parts": [
      [
        1984
      ]
    ]
  },
  "publisher": "Morrow",
  "publisher-place": "New York, NY",
  "language": "en",
  "x-bache": {
    "namespace": "bache",
    "citation_shorthand": "Ring 1984",
    "topics": [
      "near-death-experience",
      "afterlife"
    ],
    "review_state": "draft",
    "provenance": {
      "entered_by": "editor.hrl",
      "entered_at": "2025-10-28"
    }
  }
}
