{
  "id": "source:bache:LSDMU:bib:bache-1996-expanding-grof-concept-perinatal-frightening-ndes",
  "type": "article-journal",
  "author": [
    {
      "family": "Bache",
      "given": "Christopher",
      "x-bache": {
        "wikidata": "Q112496741",
        "openalex": "A5045900737"
      }
    }
  ],
  "title": "Expanding Grof’s Concept of the Perinatal: Deepening the Inquiry into Frightening NDEs",
  "container-title": "Journal of Near-Death Studies",
  "issued": {
    "date-parts": [
      [
        1996
      ]
    ]
  },
  "volume": "15",
  "issue": "2",
  "page": "115–139",
  "language": "en",
  "x-bache": {
    "namespace": "bache",
    "citation_shorthand": "Bache 1996",
    "topics": [
      "near-death-experience",
      "transpersonal-psychology"
    ],
    "review_state": "steward-reviewed",
    "provenance": {
      "entered_by": "editor.hrl",
      "entered_at": "2025-10-28",
      "meta_ref": "meta/wikidata.jsonld",
      "meta_commit": "6d3606c",
      "resolved_at": "2025-11-01T20:14:34Z"
    }
  }
}