{
  "id": "source:bache:LSDMU:bib:elliot-2019-worlds-26-richest-people-own",
  "type": "article-magazine",
  "author": [
    {
      "family": "Elliot",
      "given": "Larry"
    }
  ],
  "title": "World’s 26 richest people own as much as poorest 50%, says Oxfam",
  "container-title": "The Guardian",
  "issued": {
    "date-parts": [
      [
        2019,
        1,
        20
      ]
    ]
  },
  "language": "en",
  "URL": "https://www.theguardian.com/business/2019/jan/20/worlds-26-richest-people-own-as-much-as-poorest-50-says-oxfam",
  "x-bache": {
    "namespace": "bache",
    "citation_shorthand": "Elliot 2019",
    "topics": [
      "ethics",
      "culture",
      "activism"
    ],
    "review_state": "draft",
    "provenance": {
      "entered_by": "editor.hrl",
      "entered_at": "2025-10-28"
    }
  }
}
